{
  "account_id": "ACC-DEMO-PRIYA",
  "as_of_month": "2026-09",
  "p_roll_forward": 0.82,
  "risk_band": "high",
  "reasons": [
    {
      "code": "SALARY_STOPPED",
      "weight": 0.41,
      "text": {
        "en": "Salary credits have stopped in the last 3 months.",
        "ta": "கடந்த 3 மாதங்களாக சம்பளம் வரவு வைக்கப்படவில்லை.",
        "hi": "पिछले 3 महीनों से वेतन जमा नहीं हुआ है।"
      }
    },
    {
      "code": "MIN_DUE_ONLY_STREAK",
      "weight": 0.27,
      "text": {
        "en": "Only the minimum due has been paid for 3 months in a row.",
        "ta": "தொடர்ந்து 3 மாதங்களாக குறைந்தபட்சத் தொகை மட்டுமே செலுத்தப்பட்டுள்ளது.",
        "hi": "लगातार 3 महीनों से केवल न्यूनतम देय राशि का भुगतान हुआ है।"
      }
    },
    {
      "code": "UTILISATION_RISING",
      "weight": 0.14,
      "text": {
        "en": "Card usage has risen sharply compared with the credit limit.",
        "ta": "கடன் வரம்புடன் ஒப்பிடும்போது அட்டைப் பயன்பாடு வேகமாக அதிகரித்துள்ளது.",
        "hi": "क्रेडिट सीमा की तुलना में कार्ड का उपयोग तेज़ी से बढ़ा है।"
      }
    }
  ],
  "model_version": "early_warning-0.0.0-fixture"
}
